no,date,tweet
347,2020/03/15 21:15:27,ayo kita pasti bisa meski saya sendiri ingin kata banyak jabat yang undercapacity saya gak mau sebut nama tapi kalau memang lihat kurang mampu baik sadar dan mohon bantu kepada yang lebih sanggup kerja ini perlu presisi tapi juga rendah hati tks
348,2020/03/15 21:12:17,syukur kita punya negara pulau pulau kita dan arti ada ribu pulau dan batas yang hambat sebar virus ini dorong otonomi yg telah ada dan beri subsidi dan bantu agar waspada ini dapat laksana cara cepat dan tepat di bawah
349,2020/03/15 21:08:48,negara besaar dan lebih kuat dari kita telah umum daruratnasional kait covid ini amerika yang negara liberal itu keluar trilyunan dolar untuk pasti rakyatanya tidak punya halang untuk laku test dan periksa serta awat
350,2020/03/15 21:03:52,jangan tarung dalam isu coronavirusindonesia ini milu masih jauh sekarang kita hanya punya tuju yaitu amat rakyat lupa hal lain yang gak jelas fokus pada selamat rakyat bangsa kita dalam bahaya besar oleh ketidaktahuan kita tentang skala soal
351,2020/03/15 21:00:23,kita pasti bisa temu cara untuk satu asal kita dewasa jangan mau dibohongin oleh mereka yang biasa abs sehingga publik rasa bohong oleh perintah buka dan di atas itu kita bangun sama kita pasti bisa satu di atas jujur pasti
352,2020/03/15 20:52:12,sikap partisan harus kita kurangicovidindonesia bukan isu partisan ini bukan soal aniesbaswedan vs ganjarpranowo atau ridwankamil apalagi jokowi yang tak akan tarung lagi ini soal mobilisasi nasional untuk punya sikap dan ber hadap semua kembang
353,2020/03/15 17:37:58,kunjung lapang gak ada lagi
354,2020/03/15 10:21:31,tetap olah raga tetap jaga stamina sehat jasmani dan rohani sehat akal pikir bismillah
355,2020/03/14 23:34:25,sementara itu saya tadi temu dengan para guru di sekolah alam yang saya diri sama kawan tahun lalualhamdulillah lama jabat saya jarang tengok mereka tapi survive mohon doa restu ya saya akan kuat sani ig naturislamid dan fb sekolah natur
356,2020/03/14 23:01:39,itu saja yg saya ingin ingat bagai warga negara karena saya ingin perintah satu kita itu aja
357,2020/03/14 22:58:02,tidak enak kata bahwa dalam uu ini dan timbang ada sekarang bahwa buka informasi kait selamat unum ini wajib dan tutup bisa kena pidana lihat pasal uu no
358,2020/03/14 22:47:32,teori informasi tutup itu tidak lagi kenal di indonesia sejak uu buka informasi publik yaitu uu no sah negara harus buka apalagi kait selamat rakyat sebab selamat rakyat adalah hukum tinggi salus populi suprema lex kata cicero
359,2020/03/14 22:20:08,perintah hanya bisa laku mobilisasi total apabila buka jadi sebenarnyarakyat akan taat kok ini waktu laku mobilisasi total untuk penting nasional bismillahayuk kita satu lawancoronabersama
360,2020/03/14 21:06:43,sahabat semua harus jaga stamina jika jabat tingkat menteri kena apalagi yg lain mari kita saling doa dan saling mengingatkanvirus kita lawan dengan bias hidup yang lebih sehat yuk waspadacovid
361,2020/03/14 20:53:01,mari kita doa menteri hubung pak budikaryas moga lekas sembuhbeliau umum kena covid
362,2020/03/14 15:02:31,kopi dan buku tani dalam sepi padahal jual online
363,2020/03/14 09:58:21,pagi ini cerah sekali matahari antar dalam hangat yg kesan kau tak perlu cemas sayang aku pergi membawakerinduanku dan kembali bawa setia syukur untuk pagi yg mere segar senyum tegar jiwa hari kita akan hadap seperti biasa
364,2020/03/14 09:30:11,one more flight
365,2020/03/14 08:19:17,ubah biasa
366,2020/03/13 11:11:06,saya titip doa saja ya allah ilah kami optimisme
367,2020/03/13 10:39:59,mari kita doa yuk
368,2020/03/13 07:20:29,kompetisi henti konser batal isolasi mulai gencar dan para pimpin dunia ubah salam lalu pakai siku ada yg usul tak perlu sentuh sehingga mungkin saja serang fisik bisa kurang pandemi ini ubah prilaku jadi damaiapa yang lucu
369,2020/03/13 06:53:13,tidak elok menteri pak jokowi serang menteri yang pernah percaya oleh presiden yang sama sebab itu seperti serang presiden yang samaada problem etik di dalamnyakarena di masa lalu bijak itu pernah puji
370,2020/03/12 20:30:49,tanda mari baca
371,2020/03/12 20:02:07,tunggu arah nasionaldari pimpin nasionaltentang strategi nasionaldan mobilisasi sumberdaya nasional
372,2020/03/12 19:51:29,jangan lupa
373,2020/03/12 19:47:38,simak
374,2020/03/12 10:39:16,publik akan hilang
375,2020/03/12 10:38:17,satu perintah tuan corona ke kita sep menep kurang pesta dan banyak doa doa pun utama yg sendiri kembali ke rumah
376,2020/03/12 10:34:40,mungkin karena dunia rusuh lalu tuhan kirim corona bagai juru damairasanya sekarang semua tenangmau gampar orang takut dia kena virusalhamdulillah
377,2020/03/12 09:46:59,langkah praktis dari whomengurangi sebar virus covidindonesia
378,2020/03/12 09:41:54,tingkat silaturahim lalu media sosialkurangi sentuh fisikkeciali dengan muhrim
379,2020/03/12 06:52:34,kasi dalil sama ustdzah kopipagi kopirevolusi
380,2020/03/12 06:41:07,kopi pagi racik sendiri
381,2020/03/12 05:54:14,pasal uud fakir miskin dan anakanak yang lantar pelihara oleh negara negara kembang sistem jamin sosial bagi seluruh rakyat dan daya masyarakat yang lemah dan tidak mampu sesuai dengan martabat manusia bpjs m
382,2020/03/11 23:16:19,niat tetap untuk laksana pasal uud dan juga perintah agamaitu yg utama bukan untuk pribadi pahamkebetulan pasal dan hubung jadi taat putus ma ya
383,2020/03/11 22:31:06,aku tuh heran ya kalau dengar orang ajak taat putus mahkamah agung kok jadi hepi sendiri yasenyum gituada yg bisa jelas
384,2020/03/11 22:21:17,hmhmrasanya sebentar lagi aku dapat uang
385,2020/03/11 22:20:01,saya lebih percaya fadli dari raja belanda apalagi soal keris tau apa kompeni soal kerisbelanda itu kita percaya hanya soal keju dan kincir anginitu aja
386,2020/03/11 22:14:24,ken segera pulang kampung
387,2020/03/11 21:20:02,itu gadget pak yang kiri samsung dan yang belah nokia
388,2020/03/11 20:23:21,kulo mboten tindak pundipundi sing sabar nggeh
389,2020/03/11 20:16:52,hidup susukudaliar
390,2020/03/11 20:16:05,untuk tahu semua kuda di sumbawa itu liarjadi yg hebat orang sumbawa bagaimana merah susu kuda sambil balap
391,2020/03/11 18:42:53,kok dibroadcast
392,2020/03/10 15:16:44,di indonesia sudah bisayg belum karena dprri belum fully independent
393,2020/03/09 19:18:12,betul berul betul
394,2020/03/09 18:00:56,pengaruh rendang nan halus
395,2020/03/09 17:37:33,ma saja bisa bikin batal atur perintah bagaimana dengan mk mk bisa batal uu apa masuk omnimbuslaw maka uu harus konstitusional semua atur harur sesuai dengan uud
396,2020/03/09 11:09:40,dear narendramodi stop violence in your country like gandhi who refuses violence because he wants to live side by side you dont have to die like gandhi in the hands the radicals you just have to be moderate and kind from aieangekcottage fadlizon hotel
397,2020/03/09 09:53:43,assalamualaikum pagi dari aie angek di kaki gunung singgalang
398,2020/03/09 06:59:44,tuju kita sebut f aja biar gampang ingat kayak terminalhahaha
399,2020/03/08 16:11:21,terima kasih bung kapan kita ngopi diskusi
400,2020/03/08 06:09:21,pagi jual buku
401,2020/03/07 23:30:20,kau tau ketika aku tidur aku hilang kembali pada dan kau pun hilang tapi akan kita temu dalam mimpi sebelumtidur
402,2020/03/07 23:29:14,ini malam yg ribu suara senyap bisik doa tembus polusi udara tapi selalu ada yang harap jalan akan lipat ganda jembatan akan hubung langit dan bumi bagai pelangi air akan jernih kembali bagai fatamorgana ini malam ke ribu kau lupa janji
403,2020/03/07 23:22:59,aji bakat salam
404,2020/03/07 22:05:51,fay sambil tertawa kecil bikin video lagu bintangkejora karya at mahmud bagaimana turut anda jangan nilai nyanyi ya
405,2020/03/07 12:08:18,dan aku benar lompat
406,2020/03/06 19:08:11,tuduh papar teroris lebih capek ya
407,2020/03/06 17:12:20,polingpolingan mana yg lebih capek tuduh
408,2020/03/06 00:54:01,adapun bisnis yang akan ganggu dan rugi oleh virus korona adalah
409,2020/03/05 16:12:20,bisnis apa yang untung zaman virus corona gin ya
410,2020/03/05 13:12:32,harus ini waktu bagi indonesiapeluang dengan buka lebar
411,2020/03/05 09:21:38,saat negara galang solidaritas
412,2020/03/05 00:26:38,kau mungkin bisa temu aku di antara runtuh dan puingpuing tahta kezalimantapi aku tak bisa hadir di antara tirani dan penindasanmaka cari aku dalam bisu sampai kau tau ada aku dalam sepi
413,2020/03/04 10:13:13,ini bahan jamu saya tiap pagimadu rempah arabic gum step rempah kunyit jahe kencur kapulaga sereh cengkeh dan jeruk nipis campur air liter rebus jam dan telah hangat di beri madu dan arabic gum siap minum ayominumjamu
414,2020/03/03 14:08:11,sekal lompat tinggi
415,2020/03/03 14:00:36,cemas itu sumber dari asa tak tau dan tak daya itu tak boleh biar negara harus hadir informasi cara massif ini momen untuk galang kuat yg asal dari dalam cemas hilang dan ganti kuat serang adalah cara tahan baik
416,2020/03/03 05:07:57,di negeri ini kita mengjadapi feodalisme yg masih akutmasih banyak tempat bagi jilat dan absmengerikan
417,2020/03/02 20:30:03,mohon maaf jika ada yang kurang kenan ya
418,2020/03/02 15:17:39,ini teripang yang hidup kiri dan yg sudah masak orang sumbawa sebut banten masak tak terlalu matang masih keras dan potong kecil beri bumbu dan kelapa yang banyak rasa unik tak bisa dijelaskanhmmm
419,2020/03/02 00:36:44,terima kasih sahabat orang kampung tak pernah punya raya ulang tahuntapi usia tua buat kita harus cari cara bahagia orang tua sekali lagi terima kasih
420,2020/03/01 11:55:11,malam saya ajak naik kapal laut di selat alascek video
421,2020/03/01 05:39:18,selamat pagi bung nataliuspigai sehat selalu
422,2020/02/29 23:36:46,sebab indonesia tidak pernah absen dalam politik internasional sejak proklamasi adalah karena para diri bangsa kita percaya bahwa merdeka itu adalah hak segala bangsa jadi aktif kita universalkemanusiaan itu universalpolugri kita harus aktif
423,2020/02/29 23:17:50,kalau bung perlu jelas begini presiden kita adalah pimpin negara dengan populasi musim besar predikat itu buat kita perlu galang solidaritas manusia yang adil dan adab sesuai sila ii yg oleh bung karno milik dimensi internasional gitu
424,2020/02/29 22:25:16,ijin tum lanjut
425,2020/02/29 09:31:12,jarang lihat nih jangan ikut pensiun dong
426,2020/02/29 09:28:24,pagi sahabat mekar seperti bunga cantik pandang mata hambur wangi kata dan buat pukau karena apa yang ada dalam hati yang mulia pesona dan doa agar tuhan bagaimana telah indah wajah maka dia indah pula akhlak perangai
427,2020/02/28 22:56:14,terus jalan di bumi yang makin gersangkita harus sih bumi dan tanam kembali jadi hijautapi jangan lupa hak badan untuk istirahat sejenakselamat istirahat sahabat
428,2020/02/28 11:20:11,sholat jum at tidak bisa tunda
429,2020/02/28 09:37:57,yang hormat datuk seri anwaribrahim sungguh kami doa agar transisi politik malaysia jalan damai dan lancarsemoga kelak serum tetangga dapat saling kuat kami doa datuk sehat selalu amin yra
430,2020/02/28 08:41:10,bangun mari kita besar otot lengan
431,2020/02/28 08:12:15,bangun kau mungkin tak lihat terbitkarena mendung pagi dan gelap awan yang hitamtapi ia telah terbitia ada beri hangat
432,2020/02/28 07:33:11,bangun telah terbit matahari
433,2020/02/28 00:20:19,hening cipta mulai
434,2020/02/28 00:03:21,makan puas tetap waspada selamat ya mak mari beri makan nkri puasa
435,2020/02/27 23:42:45,itu omong lama elu aja kagak nyimak makanya lain kali kalau aku ngomong dengerin omong pahit tapi aku bicara apa ada bukan sandiwara
436,2020/02/27 23:25:14,lanjut
437,2020/02/27 09:07:52,moga sahabat gembira semua hari inijangan biar siapa rampas dari kitabehappy
438,2020/02/26 06:27:58,moga banjir telah surut pergi dan tak kembali lagiamin
439,2020/02/25 22:55:12,soal wagub dki bagus kita minta tolong om sandiuno yamasak sih gak bisa kelar kasi pak aniesbaswedan kerja sendiri
440,2020/02/25 20:45:42,wagub dki jakarta mana sih
441,2020/02/25 06:10:30,hujan malam waspada banjir kawan
442,2020/02/25 00:03:20,kau cangkir kopi pahit yang hadir pada babak akhir
443,2020/02/24 23:57:59,alhamdulillah masih melek nanti aku kirim buku sekarang bobolah
444,2020/02/24 23:44:50,om febridiansyah apa kabar om johanbudisp apa kabar om sahabaticw apa kabar belum tidur ya tidur
445,2020/02/24 23:36:50,lebih sangar siapa coba
446,2020/02/24 23:29:50,apa kabar stafsus milenial jangan lupa doa belum tidurjangan lupa cuci kaki
447,2020/02/24 13:43:14,lagi pak mahathir beri contoh yang baik bagi malaysia dan dunia malaysiaterbaru
448,2020/02/24 12:16:19,book di fahrihamzahgood aja
449,2020/02/24 10:23:43,ayo para jomblowan dan jomblowati
450,2020/02/24 07:48:53,ayo optimis
451,2020/02/24 07:48:39,kalau itu jadi semua akan jadi baik pada waktu yang tak terlalu lama mata air yang bersih akan basuh jiwa akal pikir dan tubuh bangsa dan rakyat indonesia jadi juara jadi rahmat alam semesta jadi cikal bakal adab mulia di mulai di nusantara
452,2020/02/24 07:46:18,makanya kalau ada saja masalah yang harus henti oleh pimpin kita hari ini di antara begitu banyak satu saja cipta siatem anti korupsi yang mungkin semua orang lihat bersih bagai mata air segar yg alir dari dalam pemerintahanjernih dan bersih
453,2020/02/24 07:43:12,dan korupsi karena sifat sakit yang asal dari dalam organisasi negara yang timpa pimpin dan birokrasi maka jika korupsi tidak hilang arti rakyat hanya sedang saksi pesta pora para pimpin saja biaya makin mahal hasil makin minimal
454,2020/02/24 07:39:28,eksekutif negara karena wenang dan waktu yang batas harus beri jangka waktu kapan suatu masalah akan diselesaikansebab jika tidak tiap tahun masalah rakyat hanya akan jadi janji kampanye baruini tragedi yang tidak boleh jadi
455,2020/02/24 07:35:35,eksekutif negara itu kerja dengan waktu batas kenapa karena uang yg pakai kerja tuntas pekerjaanya ambil dari keringat dan jerih payah rakyat dari pajak hasil bumi dan kaya negarajadi jangan kasi amanah malah bikin ribut dan masalah gak selesai
456,2020/02/24 07:32:30,korupsi mudah hilang itu ilmu ratus tahun di eropa amerika asia dan afrika bisa koktapi kalau ada orang sulit ya kita doakandan kalau beri amanah berantas korupsi ya diselesaikanjangan malah raya ada dan jadi modal bikin ribut
457,2020/02/24 07:06:21,jadi berantas korupsi perlu ilmu jangan sradak sruduk ya
458,2020/02/24 06:43:37,alhamdulillah moga pada sadar
459,2020/02/24 06:30:37,pagi sahabat mari simak belum terlalu jauh
460,2020/02/23 21:37:02,orang pada gak mau baca buku kayak anda gak punya ilmu lalu rasa erti persoalannanti kita jewer pada waktu
461,2020/02/23 20:00:48,sudah tiba kembali di jakartaterbang cuma menit beda jauh amat yak
462,2020/02/23 19:33:14,tetapi alir ke laut tuju ke laut capai laut laut abdi kepada negara dan tanah air yang irama gelombang gelora ir soekarno
463,2020/02/23 17:25:56,cangkir atau gelas ke hari iningopi sore di airport raden inten
464,2020/02/23 15:00:43,marah dan kecewa pada karena aku perlu itu
465,2020/02/23 06:54:47,bismillah take off lampung
466,2020/02/22 23:55:26,nanti ada waktu saya bongkar tuntas soal ini tenang ajasekarang tidur dulu gihngurus negara itu berat biar aku aja
467,2020/02/22 23:53:32,ayo tidur kawan ini akhir pekan pakai istirahat
468,2020/02/22 23:10:07,doa ya soal ini bukan panas politik ini ngopi biasa aja cangkir kopi dan buah harap
469,2020/02/22 21:50:52,sampai ketemu di lampung besok ngopiyuk
470,2020/02/22 21:20:25,selamat semua maju terus ya
471,2020/02/22 12:49:25,hubung apa
472,2020/02/22 12:09:36,kasus yg henti kpk itu apa saja ya
473,2020/02/22 00:07:37,terus simpan harapanseperti ketika kau ingin pada malam gelap ada cercah cahaya yang sinar menep cemas yang entah datang dari mana bukuputihfh suarakusepi
474,2020/02/22 00:03:33,terima kasih telah datang kepada para guru dan sahabatini ikhtiar sederhana bunyi apa yang saya anggap benar terima kasih dukunganya bukuputihfh
475,2020/02/21 11:34:57,selamat jumatberkah jangan lupa pakai parfum
476,2020/02/21 11:01:24,maka dengan rendah hati saya sembah bukuputihfh ini dan selamat ikut bedah buku bagi yg sempat ikut dan selamat baca bukuputihfh
477,2020/02/21 10:58:29,sekali lagi partai politik kita adalah rahim bagi demokrasi indonesia yg apabila gagal terap prinsip daulat rakyat di dalam maka partai politik akan dengan sangat mudah jebak pada boleh atau bahkan permisif hadap oligarki dan politik dinasti
478,2020/02/21 10:56:59,bukuputihfh sy tulis untuk kembang partai politik kita depan yang sama sekali tidak boleh arah kepada kuasa kelompok orang atau mati prosedur sehingga hakhak anggota yg di dalam ada hak asasi manusia rampas dengan sangat mudah
479,2020/02/21 10:54:03,karena itu konsepsi daulat rakyat dalam tradisi konstitusi indonesia harus warna seluruh tradisi negara kita daulat takyat adalah rupa suatu konsepsi yang serius dan sangat kuat ini tanda demokrasi kita yang sungguhsungguh bukuputihfh
480,2020/02/21 10:52:05,daulat rakyat seperti yg kita dengar dan kita lihat di dalam buka uud bahkan telah tuju negara dan belum pancasila sebut sebut prinsip yang daulat rakyat dengan dasar kepada tuhan yang maha esa dan terus bukuputihfh
481,2020/02/21 10:45:17,itu sebab dalam buku ini rekam beberapa jejak teoritis debat antara daulat partai politik yg belakang ini nampak makin kuat jalan dengan turun citarasa demokrasi kita hadap dengan daulat rakyat yang telah cara sangat kuat patri dlm uud
482,2020/02/21 10:43:25,penting bagi kita untuk bincang masa depan selenggara negara dengan beri perhati kepada masa depan kelola partai politik demokrasi tidak bisa hindar eksistensi lembaga yg rupa jembatan tuju negara ini bukuputihfh
483,2020/02/21 10:31:21,sejak awal pks anggap remeh putus adil tapi saya akan diri dukung adil tetapi jauh lebih penting adalah jelas baik cara teoritis maupun dalam praktek apa yang jadi dasar dan apa yang jadi jadi benar dalam peristiwa sebut
484,2020/02/21 10:29:26,meski pks tolak sekarang sedang tunggu hasil dari wajib yang harus bayar pks kepada saya rp miliar telah peristiwa kasasi inkracht dana itu akan saya untuk bagi masyarakat khusus rakyat yang tidak untung fakir miskin dan anak lantar
485,2020/02/21 10:25:52,adil negara identifikasi ada buat lawan hukum pmh upa adil sesat dan pmh lain sehingga cara jenjang dari adil negeri adil tinggi dan mahkamah agung cara konsisten buat pimpin pks telah batal bukuputih fh
486,2020/02/21 10:21:06,bukuputihfh ini tentu rupa karya yang picu oleh peristiwa yang jadi th lalu ketika saya henti pks dari seluruh jenjang anggota pemulamudadewasaahli tanpa sebab dan alas sehingga pecat sebut kalah batal oleh adil negara
487,2020/02/21 09:09:50,teman mohon doa hari ini mau luncur buku yg sudah cukup lama saya rencana ini adalah bukuputihfh yang rekam buah debat yang serius tentang bagaimana debat tentang daulat parpol vs daulat rakyat moga manfaat bagi bangun demokrasi ke depan
488,2020/02/20 19:07:21,barokallah emak indonesia maju terusini waktu bangkit bravoemakindonesia
489,2020/02/20 04:02:46,kapan undang dia jadi narsumsupaya dia baik filsafat yg rusak oleh ilctv tuju ya bang karniilyas
490,2020/02/19 22:05:00,tidak ada sengaja
491,2020/02/19 22:02:51,nengok ke rumah itu belanja tanpa batas ada taman indah ngemplang tambah banyak gardu dari besi dan kaca kursi tamu kulit kilat rejeki kayak air udah ada mobil beli jalan raya tiap hari proyek baru awal aku decak kagum luar biasa utang semua nyata
492,2020/02/19 21:45:29,nengok ke rumah itu listrik tanpa batas garasi dan taman indah mobil tambah banyak pagar dari besi dan kaca lantai marmer kilat hampar karpet sia atap genteng warna kolam renang dan sauna awal aku decak kagum luar biasa nyata utang semua
493,2020/02/18 23:30:21,moga lekas sembuh
494,2020/02/18 09:30:52,apa kabar indonesia apa berita gembira buat kita hari ini
495,2020/02/17 18:27:28,siap komandan
496,2020/02/17 00:03:21,teman doa pekan ini kita launching sederhana bukuputihfh ini biar tuntas saya gak ada beban dan hutang piutang lagi buku ini cerita banyak fakta hubung antara jabat yg pilih rakyat elected official dengan parpolnya buku gak mahal kok
497,2020/02/16 16:02:27,video yg tarik ringkas isi pikir presiden
498,2020/02/16 10:21:19,selamat tinggal sahabat terima kasih bengkulu lewat patung bunda fatmawati belum tuju airportikon baru kota bengkulu
499,2020/02/16 07:04:00,akhir dapat juga gadgetbengkulu upa tongkatpakwali yang beri kepada saya supaya terus ingat kota ini terima kasih pak wali
500,2020/02/16 06:35:18,hari di bengkulu cangkir kopi ceramah sahabat mata acara talkshow be tv beken nasehat nikah kultum walikota temu kader gelora kuliah ormas pemuda padat juga
