no,date,tweet
1,2020/05/10 10:02:34,masa depan indonesia
2,2020/05/10 09:57:59,masa depan indonesia
3,2020/05/10 07:36:16,lebih tajam di antara negara yang paling sukses atas wabah covid
4,2020/05/10 07:12:52,di antara negara yang paling sukses atas wabah covid
5,2020/05/10 06:12:39,turut anda siapa yang salah dalam kasus pandemi global covid
6,2020/05/10 00:08:03,sambut hari ke ramadhan malam al quran turun bunda nenowrs sama keluarga nyanyi buah syair indah tulis oleh emha ainun najib dan aransemen oleh sapto raharjo tahun silam jangan lupa like share dan subscribe
7,2020/05/09 22:26:39,jangan padam kawan cahaya seperti indah purnama malam ini aku tahu ada kepahitantelanlah sama senyum kau bagi tak tergantikankau adalah masa depanjangan mundur jangan terkuncijangan mau kalah hanya allah tuju harikeenambelas
8,2020/05/09 21:56:23,harikeenambelas optimisme itu datang dari dalam hatimumaka apabila ia cahaya dan terang ia akan datang bawa kabar gembira pada diri sendiriapapun situasi di luar
9,2020/05/09 08:41:38,wanted covid bin corona
10,2020/05/09 08:38:54,khilafah covidiah
11,2020/05/09 06:09:43,kalau kita tahu banyak bom waktu mari kita doa moga gak ledak
12,2020/05/09 05:56:54,ramadhan adalah bulan solidaritaskita harus lawan hendak untuk buat kita sepi dan sendiri waspadacovid yang buat kita jaga jarak lalu seret kita pada sikap sepi dan sembunyitetap bahagia dan tetap gembira kawan staysafe stayhealthy
13,2020/05/09 05:46:23,di negara barat orang mulai bahas mungkin akan tingkat angka bunuh dirijadi orang justru dorong untuk peduli sama telah social distancing anggap buat orang jadi tidak peduli sesamamulai muncul asa sepi dan frustrasi waspadacovid
14,2020/05/09 00:36:01,kenapa bapak tidak umum corona bagai musuh sama
15,2020/05/09 00:06:42,kalau bapak dua gak bisa cari musuh besama nanti bapak dua jadi musuh sama lo
16,2020/05/09 00:01:13,pak jokowi dan pak prabowo yuk kita cari musuh sama yuk
17,2020/05/08 23:59:18,tim dan masih antem padahal bulan puasa dan ada coronadan para jagon sudah piring dua
18,2020/05/08 08:12:26,apa kabar pak kyai moga sehat selalu jangan lupa jaga sehat bangsa ini masih tunggu jumatberkah ramadanmubarak
19,2020/05/07 19:31:06,turut duka cita moga allah swt terima segala amal dan ampun segala salah
20,2020/05/07 16:59:17,gara corona aku jadi suka mampir di channel atta ricis dan mpok nur
21,2020/05/07 15:31:10,baru saja selesai zakatinofficial talk iklan dan aktual beda
22,2020/05/07 00:20:57,hariketigabelas yang penting apa sih
23,2020/05/05 23:41:37,innalilahiwainailaihirojiun sama seluruh sahabat partaigeloraid saya ucap belasungkawa yg dalam atas pergi almarhum kempot moga allah swt letak minakhlulkhair dan kita yg tinggal beri sabar amin yra
24,2020/05/05 16:37:53,sekolah alam naturislam sekarang kan sekolah wfh jadi karena gak kasi makan murid maka dapur kita buka layan pesan umum silah kontak cp ibu aulia fitriani media sosial ig naturislamid fb sekolah natur islam
25,2020/05/05 07:51:42,harikeduabelas apa kabar pak prabowo dan pak jokowi masih aman kan bapakkabari ya kalau ada apaapa ramadanmubarak jagastamina
26,2020/05/04 01:51:32,harikesebelas baru saja ambil gambar ini dari depan masjid depan rumah indah luar biasa tuju maghfirah
27,2020/05/03 20:51:10,harikesepuluh ingat haripendidikannasional persis tepat dengan ramadanbulanpendidikan syahruttarbiyah apa makna dan hubung dengan merdeka simak video ikut
28,2020/05/03 13:00:54,harikesepuluh satu fase rahmat akan lewat tuju mahfirah ramadanmulia
29,2020/05/02 22:39:18,sambil raya dan ucap selamat haripendidikannasional saya tadi ikut conference dengan guru di sekolahalamnaturislam evaluasi kembang proses ajar ajar lama wfh ucap lengkap saya ada di channel fahrihamzahofficial
30,2020/05/02 22:00:16,iklan like subscribe jangan ketawa ya kawan kalau di channel youtube fahrihamzahofficial sekarang ada video gin coba deh
31,2020/05/02 19:19:11,harikesembilan tadi ada diskusi
32,2020/05/02 18:23:05,kemarin saya sampai selamat hariburuhsedunia
33,2020/05/02 16:13:18,prediksi resesi ekonomi pasca pandemi akan reformasi ulang
34,2020/05/01 05:39:49,simak
35,2020/05/01 05:26:33,
36,2020/04/30 20:53:48,habis taraweh boleh dagang lagi kan kopirevolusi jangan lupa
37,2020/04/30 10:06:09,apa isi ini dia terima kasih ya kawan atas dukung dan partisipasi
38,2020/04/30 09:19:46,manteman ada berita gembira nih dari youtube untuk channel fahrihamzahofficial kita buka yuk
39,2020/04/30 06:15:51,ayo yang di bal
40,2020/04/30 06:11:23,ayo yang lain mana bisnis
41,2020/04/30 05:16:00,hariketujuh arti umrah juga boleh lagi
42,2020/04/30 05:02:17,hariketujuh dari virus mesin ke virus manusia
43,2020/04/29 22:25:53,ada yang bisa bantu saya untuk paham bisnis milenial di sekitar istana ini ya siapa tahu memang hebatmemang layak dapat proyek negarasiapa tau
44,2020/04/29 22:00:44,kalau kalian dapat percaya dari orang lugutetaplah kalian tidak boleh tipu hariketujuh jelang
45,2020/04/29 16:11:56,wabah sebar indonesiar ambyar
46,2020/04/29 16:06:13,ngajol pol bareng bang fahri hamzah wabah sebar indonesia ambyar rabu april wib live on zoom youtube channel gelora jatim youtube channel
47,2020/04/29 06:56:45,harikeenam tetap semangat ya
48,2020/04/28 05:24:41,harikelima duh sudah hari ke
49,2020/04/28 01:44:22,harikeempat kata corona ini telah selamat bumi dan manusia dgn henti polusi udara memang foto yg kirim satelit nasa belakang ini tunjuk bumi makin bersih dari polusi paru manusia kian sehat covid dan ramadan sehat kita kata
50,2020/04/27 00:32:04,hariketiga trump suntik desinfektan kim jong un gagal operasi
51,2020/04/25 23:07:40,harikedua tema ramadanmubarak belum bisa kalah tema covid apakah ketika syawal nanti kita raya harikemenangan iedulfitri kita juga bisa menang dari corona apakah kita akan kumpul di tanah lapang dengan takbir dan tahmid atau lagi dirumahaja
52,2020/04/24 11:46:51,haripertama kawan covid dan ramadanmubarak punya satu sama aja untuk kembali pada diri sendiri selamat laksana ibadah ramadhan jumatberkah
53,2020/04/23 18:28:55,dalam suasana jagajarak dan pakaimasker tadi sore saya waketum tum anismatta bendum dan sekjen mahfudzsiddiq partaigeloraid ucap selamat laksana ibadah malam pertama ramadan moga amal kita terima amin yra
54,2020/04/23 07:25:38,krisis ini bukan waktu untuk minta baik sangka rakyat rakyat lagi susah tapi ini waktu untuk mulai tradisi buka dan buka nanti agar kita saling tahu kurang dan lebih ini awal sama dan bangun solidaritas bangsa gelombangsolidaritas
55,2020/04/23 07:17:09,dalam demokrasi lebih baik bohong yang buka daripada orang jujur yang tutup sebab bohong yang buka bikin siaga tapi orang jujur yang tutup buat kita lalai bentuk buruk adalah bohong yang tutup bentuk baik adalah orang jujur yang buka
56,2020/04/23 07:11:19,kita tlh pilih jadi negara demokrasi dgn ingin berantas semua takhayul dan khurafat di sekitar pimpin bahwa mereka manusia biasa seperti kita mungkin saja lebih lemah tak mengapa asal dia jujur buka dan apa ada maka kita akan bantu kuat tenaga
57,2020/04/23 07:06:11,tarik ambil contoh trump tiap hari debat dengan wartawan yang kadang ban omong dengan data dan dia pojok data ban tapi amerika maju tanpa misteri tapi kimjongun jarang muncul dan tiba dia kabar sakit keras korut cekam
58,2020/04/23 07:00:20,dalam krisis seperti ini pimpin harus sering dengar dan buka cakap apa ada sebab ada getir yang tak dengar bukan pimpin yang baik yang tampil hanya sekal dan kata percaya kami telah buat untuk rakyat di hati kami hanya rakyat
59,2020/04/23 06:55:51,asa asing di telinga saya jika ada orang hebat hendak baik sangka terusmenerus padahal nyata telah ubah dan tak ada yang nama baik sangka jika percakapn belangsung satu arah baik sangka adalah akibat dari gemar kata jujur di hadap rakyat yg tanya
60,2020/04/23 06:52:20,puncak dari santun adalah cermin pada benar pada ucap bukan pada bahasa tubuh dan main kata untuk putar balik fakta jika jujur jadi sulit kata di hadap kuasa maka saat itu ronta kata perlu
61,2020/04/23 06:43:13,kerja ecek benar omong pimpin adalah kerja yang paling penting dalam demokrasimisalnya mereka kata percaya bahwa kami kerja untuk rakyat tetap rupa nyata yang harus periksa sebab semua tiran juga nyata hal yang sama
62,2020/04/22 22:02:27,how are you kimjungun
63,2020/04/22 20:17:57,ceramah tarhibramadhanonline pak anismatta malam ini luar biasa silah simak
64,2020/04/22 15:09:50,teman khusus yg muslim besok kita sudah mulai sholat tarawih nanti malam partaigeloraid ada tarhibramadhanonline sama tum anismatta buka untuk umum sampai ketemu malam ini jam wib di link dan
65,2020/04/22 11:11:26,dapat kirim video dari teman partaigeloraid papua keren deh
66,2020/04/21 09:55:29,the more you talk the more you make mistakes and i can understand why there are people who dont like to talk
67,2020/04/21 09:50:50,nampaknya as akan punya presiden baru ya
68,2020/04/21 00:08:09,jaya adalah milik mu ya allah kau ikan kepada siapa yang kau hendak dan kau timpa malapetaka dan hancur kepada siapa pun yang kau hendak maka ampun kami ya allah beri kami waktu untuk taubat amin marhabanyaramadhan
69,2020/04/20 23:06:49,dalam nostalgia ada tenaga yang belum bangkit ada cinta yang masih dekam dalam penjara ada kuat yang sembunyi tapi ada angkara murka tapi ada benci hati yang tidak bening niat yang jahat pikir yang licik dan kata yang dusta siapa yg jaya
70,2020/04/20 22:54:23,tiba aku nostalgia kenang lagu cinta dan rindu semerbak tawa generasi yang penuh manja dan kita jadi lemah rasa takut hampir jiwa yang goyahmenjemput kematianterbakarhangus dan mati tiba aku nostalgia masa depan yang kejam
71,2020/04/20 21:21:35,kalau kita percaya ini krisis maka kita perlu manajemen krisisdan tentu pimpin krisis pada semua lini darijubircorona
72,2020/04/20 17:54:43,azan magrib duaharijelangramadan mohon maaf lahir bathin
73,2020/04/19 20:07:58,ikut juga diakusi live zoom tentang politic decision making process tangan covid di akun fb dan youtube saya dirumahajaya
74,2020/04/19 20:01:53,politic decision making tangan covid
75,2020/04/19 19:12:16,ini youtube nya
76,2020/04/19 18:40:06,yuk hadir
77,2020/04/19 08:38:44,kan ada menhan
78,2020/04/19 05:30:55,ayo warga jakarta follow wagub dki yg baru kinijakartapunyawagub
79,2020/04/19 00:10:12,situasi kita ini
80,2020/04/18 07:33:17,jauh ini tangan covid oleh perintah
81,2020/04/17 23:59:58,dalam situasi ini turut anda apa yang lebih butuh rakyat dari perintah
82,2020/04/17 20:36:08,tuju atau tidak jika ramadhan besok semua lockdown buka aja
83,2020/04/17 18:26:50,jelangramadhan
84,2020/04/17 17:56:40,selamat datang
85,2020/04/17 17:55:50,beli
86,2020/04/17 14:22:04,turut anda opsi mana yang lebih baik bagi rumah ibadah tempat kita sembah tuhan
87,2020/04/17 12:33:04,tadi yang biasa jumat pergi jumat gak jumatberkah
88,2020/04/17 05:38:08,masker dasar warna partai tapi apa boleh sumpah dengan mulut dan wajah tutup ya ayawae
89,2020/04/16 09:31:46,simbol ini nasib mu kini tetapdirumah
90,2020/04/16 07:11:29,bangun tidur kopi kental sebut expresso pagi lagi kopi hitam sebut americano siang kopi susu sebut capuccino sore kopi susu tambah busa sebut macchiato malam kopi tambah banyak susu sebut latte apa lagi
91,2020/04/15 16:23:20,doa ibu ya
92,2020/04/15 14:10:04,sekali lagi mari gaung bebas untuk orang anak bangsa yang berani dan jasa hadap gelombang wabah di masa lalu bebaskansitifadilah demi mandiri indonesia di tengah wabah global yang makin ganas saveindonesia
93,2020/04/15 14:08:11,jangan sampai gajah antem kita kena injak pak jokowi bagus biar mereka rantam dan jadi lemah supaya adil global bisa cipta paling tidak biar mereka sadar bahwa mereka gak bisa hidup sendiri dengan pakai lembaga mulitilateral bebaskansitifadilah
94,2020/04/15 14:06:19,dengan bebaskansitifadilah maka presiden jokowi akan punya sempat untuk dengar sisi lain dari catur global kait covid ini agar bangsa indonesia tidak jadi korban tarung yang kita tidak erti justru kita harus ambil sempat sekarang
95,2020/04/15 14:03:51,saya tau lobby yang ingin sumbat mulut beliau kuat sekali bahkan akhir saya dengar beliau tidak dapat ringan karena tuduh dekat dengan kelompok radikal dan teroris moga pak jokowi dengar apa yg benar bebaskansitifadilah adalah suatu yg benar
96,2020/04/15 14:01:30,harus tidak ada hambat bagi perintah pak jokowi untuk bebaskansitifadilah karena aniaya kepada beliau tidak dalam masa rezim ini justru beliau harus curiga mengapa ada kelompok yang penting betul untuk urung perempuan umur tahun
97,2020/04/15 13:28:14,presiden as mau henti bantu biaya ke who karena anggap main mata dengan china maka ini saat presiden jokowi bebas prof siti fadilah akan makin jelas bahwa beliau penjara karena lawan para raksasa mumpung mrk lagi antem bebaskansitifadilah
98,2020/04/14 21:23:37,salam semua
99,2020/04/14 09:23:02,cocok
100,2020/04/14 07:27:39,media di amerika soal kembali karena presiden trump anggap remeh covid ini sejak awal
101,2020/04/13 14:18:31,sair maestro
102,2020/04/13 12:10:59,tepat sih tahan sabar meski sudah gak kuat tetap tahan sabar ngerti nggak lu sabar
103,2020/04/13 12:04:37,sabar ya orang sumbawa bilang kareng sabar ade tu bentan arti tinggal sabar yang kita jinjing maksud ya sabarmemang ada kita gin
104,2020/04/12 16:08:54,yuk bantu beli untuk beri berbagisesama
105,2020/04/12 07:34:02,wfh adalah
106,2020/04/12 07:07:38,belum cair
107,2020/04/12 07:03:12,assalamualaikum lapor pagi cappucino tinggal tengah apakabar dunia luar sana sehat selalu dan tetap bahagia socmed untuk bagi cerita positifjangan tambah sedih dan putus asa
108,2020/04/11 23:48:46,pause
109,2020/04/11 20:31:13,kata ada ledak keras jabodetabek yang infobmkg aja gak bisa jelas ada yang tau
110,2020/04/10 23:04:01,ayo belum tidur kita minta ibu prof dr siti fadilah supari bebas tandatangan petisi ya bebaskansfs
111,2020/04/10 20:11:01,pandemi covid kita mau ngapain
112,2020/04/10 20:08:13,covid kita mau ngapain
113,2020/04/10 18:09:00,terima kasih emak moga allah swt balas semua baik savetenagamedis
114,2020/04/10 15:57:53,enak sekali rasa
115,2020/04/10 11:23:49,insya allah malam nanti jam wib ngobrolbarengfahri via live youtube kita ngobrol soal pandemi covid sama bang fahrihamzah jangan lupa ya nanti malam link youtube ada sini
116,2020/04/10 09:28:13,terima kasih kepada yang komentar saya tambah kurus tetapsehat
117,2020/04/10 09:12:19,belum atlet nih gaes tapi tetap olahraga yg penting sehat stayhealthy stayathome mulaidaridiri
118,2020/04/10 00:01:05,
119,2020/04/09 15:48:19,dirgahayu tni angkat udara ke jaya tni au swa bhuwana paksa sayap tanah air jelajah angkasa jaga daulat negara satu republik indonesia huttniau tniau
120,2020/04/09 00:15:08,bukankah iman adalah cara kita lawan darijubircorona
121,2020/04/09 00:07:23,hei orangorang yang kata jago tunjuk diri darijubircorona
122,2020/04/08 22:17:14,kenang di bulan februari sy dan bro fahrihamzah hadir sbg undang di acara talkshow drtompi dan glennfredly di narasitv kami ngobrol n diskusi banyak hal sy turut duka cita sedalamdalamnya atas pergi glennfredly nyanyi hebat
123,2020/04/08 21:42:05,saya fadlizon drtompi dan mendiang glenfredly foto dengan gaya action sekitar maret kami bicara seru di narasitv atas undang najwashihab sang milik hari ini kita dengar glen pergi siapa yang tak luka selamat jalan glen
124,2020/04/08 20:56:21,makasih
125,2020/04/07 22:13:00,ayo sahabat jangan biar diri hantu rasa takutjangan sedih jangan lemah jangan rasa ruang hidup ini sempit janganmenyerah
126,2020/04/07 21:52:03,hidup ini beri kalau hidup kita ambil selain kita tidak punya cara untuk menolakkita juga tidak punya haktetapi jalan hidup dengan rasa takut adalah sifat kecut jalan hidup dengan gagah berani karena ia adalah beri baik janganmenyerah
127,2020/04/07 21:14:09,hidup positif pikir positif rupa sumber daya tahan hidup janganmenyerah
128,2020/04/07 13:51:44,sementara kita kunci dalam rumah matahari terang sekali sejak pagiharusnya covid sudah mati di luar sanasisanya yg ada di tubuh kitabagaimana di tempat sahabat
129,2020/04/06 17:45:02,selamat kepada pak a riza patria bagai wagub dki yang baru
130,2020/04/06 16:48:50,hari senin ya
131,2020/04/06 06:36:48,gimana
132,2020/04/06 06:29:38,ayo ikut polling tarik iniinternetgratis
133,2020/04/05 21:54:56,selamat rapat jagajarakjanganbandel
134,2020/04/05 20:13:03,nonton belum tidur besok senin ke
135,2020/04/05 13:50:55,innalillahi wainna ilaihi roji un tadi pagi kita hilang orang guru alm dr ahzami samiun jazuli beliau adalah orang ulama tafsir yang sederhana dan sahaja bagai orang yg kenal dekat saya saksi bahwa beliau adalah orang baik min ahlul khair
136,2020/04/04 23:05:38,dengar mati orang dr garis depan aku ajak kita doa untuk selamat wahai orang yang dekat resiko mati siang dan malam wahai para pahlawan kami doa moga allah tuhan yang kuasa lindung jiwa raga kalian amin yra savetenagamedis
137,2020/04/04 18:58:13,mari kita dengar hebat bang haji
138,2020/04/04 18:34:00,ada berita lagi dari corona
139,2020/04/04 12:00:49,putar ulang kembali ya
140,2020/04/04 11:43:23,aku baru dengar dari coronaternyata ada satu kata yang paling mereka benci adalah cinta dan kata yang paling mereka suka adalah benci suaracorona
141,2020/04/03 21:15:25,selamat nikmat indonesiapusaka indonesiabisa indonesiabangkit
142,2020/04/03 20:06:32,luncur video clip indonesia pusaka
143,2020/04/03 20:04:20,luncur video clip indonesia pusaka
144,2020/04/03 18:31:16,habis sholat isya nanti saya sama pak fadlizon dan bunda nenowrs ajak kita nyanyi kembali indonesiapusaka yuk ikutanindonesiabangkit
145,2020/04/03 16:56:45,hahahaha
146,2020/04/03 16:23:02,sahabat ukmindonesia banyak yg ingatin saya hati banyak tipu barang haram dll tolong jujur aja kalau mau nipu biar yg mau tipu juga ikhlas makan yg gak cocok bagi semua orang misal kandung unsur haram tolong juga jujur ya kita semua lagi susah
147,2020/04/03 15:20:07,disclaimer saya hanya bantu ukm dalam promosi produk mereka di tengah wabah yg ancam usaha kecil kita saya belum pernah coba silah langsung hubung dengan ukm yg saya rt terima kasih makin rt makin lapar saya
148,2020/04/03 15:14:27,nahhhh senang saya pa begini nih bagus pa fahrihamzah usaha konveksi saya sdg lesu pa saya nitip pa jahit kaos saya ngisi waktu bikin masker non medic uang hasil jual buat jahit sendiri bahan kain kaos harga rblusin hari ini ready lusin lusin
149,2020/04/03 15:08:19,numpang jual bang kami umkm aseli boyolali produksi abon sapi ayam non msg dengan bagai pilih kualitas dengan masa exp th jamin halal bisa kirim untuk mesan silah hubung pipit nita
150,2020/04/03 14:59:37,fahrihamzah bang numpang promosi tas tote bag info
151,2020/04/03 14:59:21,izin jual masker bang fahri wa
152,2020/04/03 14:53:00,new version speaker quran maghfirah total unggul total qori total kaji islam total ustadz populer info mesan wa
153,2020/04/03 14:03:00,paru pedas ceu ati dr bdg cuman rb rasa pedas mercon original hp tks bang fahrihamzah
154,2020/04/03 14:00:12,titip promo bang jasa website profesional terima buat website usaha toko online dll kunjung website
155,2020/04/03 13:59:07,mohon bantu donasi aja pak
156,2020/04/03 13:51:19,buku questparenting pola asuh anak bas identitas harga ribu pesan via wa terima kasih pak
157,2020/04/03 13:45:50,bang nitip lapak ya di jogja jual dimsum mentai semenjak ada corona bnrn sepi bgt padahal ini jamin enak dan sedia di gofood jg lho matur nuwun
158,2020/04/03 10:54:54,garagara ini bu siti fadilah supari di
159,2020/04/03 10:53:11,empon empon kuat daya tahan tubuh tengah badai wabah coronahome made yang bikin tetangga saya bang beli lusin dapat potong harga khusus
160,2020/04/03 10:52:19,ikut promo pak konveksi di majenang cilacap masker kain lembar klusin lembar k lusin bisa pesancustom jumatberkah juga kunjung link kami
161,2020/04/03 06:44:51,rt session pertama udah dulu ya majuterusukm
162,2020/04/03 06:12:18,bang fahri sy engineer konstruksi biasa desain struktur bangun mohon dbantu dong
163,2020/04/03 06:24:22,labiba hijab collection toko online gamis syar lebih banyak model cek ig labibahijabcollection wa
164,2020/04/03 06:37:03,nitip ya bang tas handmade jogja jamin antipasaran bisa follow ig
165,2020/04/03 05:50:19,selagi dirumahaja uang bisa tabung emas kumpul logam mulia minigold dengan aneka pilih ukur mulai dari gram gram gram dan gram kumpul dan tukar minigold dengan lm antam di distributor resmiwil sby di no
166,2020/04/03 06:36:31,yug order wedang uwuh praktis tinggal seduh air panas rbpack isi bgks emponempon rbmika gula jahe praktis tinggal seduh air panas rbpack isi buah harga bom masuk ongkir kirim dari magelang sila dm untuk order
167,2020/04/03 06:36:19,cemilan kerupuk cocok untuk stayathome kaya gin diri dari rasa pedas kencur original rendang
168,2020/04/03 05:45:28,jual bando bayi handmade unik tidak pasar harga murce sekali rb isi pcs minat wa aja kirim photo bando yg ready nya ya bebas pilih sesuai ingin kirim dari bekas terimakasih
169,2020/04/03 06:33:07,bantu promosi ya bang umkm baru bulan ini buka brand sendiri punya market place di shopee
170,2020/04/03 06:28:02,pagi bang fahri kami dr majestycleather brand lokal khusus rajin tgn bahan kulit sapi nabati asli yg bahan kami import dr amerika semua proses dgn tangan tanpa mesin alias handcrafted kami pny bbrp ready stock dompet yg ingin sumbang mgkn bang fahri minat
171,2020/04/03 06:27:06,silah ready madu propolis langsung dari tani madu di tanggung order
172,2020/04/03 06:22:21,selamat pagi pak tanggulang corona dengan hidup sehat yuk konsumsi kurma dan madu dsri emier healthy food terimakasih
173,2020/04/03 06:08:53,madu asy syifa rb
174,2020/04/03 05:43:47,masker lasser cutting satu lusin dan kodi bahan scuba minat silah
175,2020/04/03 06:02:21,hand sanitizer gel isi ml harga rp ribu
176,2020/04/03 05:46:38,voal printing scarf dengan motif pinto aceh by seenong boleh di follow ig seenong
177,2020/04/03 05:45:15,kripik usus
178,2020/04/03 05:36:56,yg ini bang
179,2020/04/03 06:20:15,bantuin bangproduk lokal ksb kami produksi vco virgin coconut oil harga k untuk ml k untuk
180,2020/04/03 06:17:31,
181,2020/04/03 05:34:31,teman ukm yg punya dagang onlen mau promosi lewat twitter nanti saya bantu retweet biar banyak orang yang tahu klo bisa serta foto produk yg bagus bismillah bantu ekonomi rakyat yang lagi berat jumatberkah
182,2020/04/03 05:32:58,gak lah
183,2020/04/03 01:10:48,selamat tidur corona
184,2020/04/03 01:09:33,iman tidak siap obat tapi siap kita temu mati tapi sains dapat temu obat tapi tidak bisa siap kita hadap mati mingkin ini sebab geger ini sebelumtidur
185,2020/04/03 01:00:46,padahal iman harus buat kita tenang hadap misteri hidup dan sains buat kita tenang lihat staistik mati sebelumtidur
186,2020/04/03 00:54:21,bangsa yang cemas mati adalah yang cemas hidup sebelumtidur
187,2020/04/03 00:51:56,adab yg akan lahir harus punya perspektif yang baik tentang mati sebelumtidur
188,2020/04/03 00:15:17,confidence resolves half of the problem
189,2020/04/02 23:44:40,karena itu dia bui
190,2020/04/02 23:04:30,saya juga lagi nagih pak
191,2020/04/02 22:30:57,yang penjara siti fadilah adalah musuh bangsabertaubatlah
192,2020/04/02 22:24:59,bismillah tawakkal dan yakin aku salah adalah awal dari baik besar dan sekali lagi kita akan jalan sama harap itu masih ada kepala tetap tegak untuk yakin bahwa bangsa ini akhir akan pilih jalan baik bebaskansitifadilah
193,2020/04/02 22:20:23,saya adalah saksi yang teriak keras meihat praktek hukum kpk di masa lalu ini waktu yang sangat baik ayo kata arah baru kalian ke mana jangan ikut kelompo kecil orang kecut dan cundang dari masa lalu yang tidak mau aku salah diam hilang
194,2020/04/02 22:17:14,kpk tetap harus pimpin orkestra ini dan saya haru kpk tuju bebas korban di masa lalu kata niat besar kpk di belakang semua ini pasti ada arif baru karena aku bahwa sombong dan tepuk tangan di masa lalu tak sempat buat introspeksi
195,2020/04/02 22:14:31,saya ingin kpk yang pimpin bangsa ini dalam taubat tega hukum yang sembrono di masa lalu yang masuk rasuk kpk aku salah dan mari kita lihat ke depan dunia sedang ubah dan ini waktu yang baik bagi ubah dan kita bisa laku
196,2020/04/02 22:06:12,tapi hukum yang telah hilang jiwa dan jelma jadi alat balas dendam dan rekayasa kita akhir mari kita introspeksi mari kita pasuk zaman baru tega hukum yang dapat hidayah tuhan hukum harus kembali jadi yang mulia seperti gelar majelis hakim
197,2020/04/02 22:03:47,aku tetap didih lihat laku aparat tegak hukum di masa lalu dan di masa yang akan datang yang pakai hukum seperti milik mereka sendiri lalu jadi kaki tangan pihak luar untuk target bangsa sendiri aku sakit hati aku tau apa yang jadi bebaskansitifadilah
198,2020/04/02 22:02:11,ibu siti adalah pahlawan dunia suara gema pecah suasana tidak bisa lagi milik uang negara adikuasa dan pegang otoritas global main nasib kita negara yang rakyat hidup dengan butuh dasar ala kadar bebaskansitifadilah
199,2020/04/02 21:53:28,aku sama ibu siti fadilah suparikorban rekayasa hukumksatria indonesia lawan otoritas global yg ingin buat kita jadi korban ibu tuduh korupsi dlm sidang yg lelah tahun lalu vonis tahunmantan menkes itu masih dekam dalam panjara
200,2020/04/02 20:41:49,ada yang tau kpk lagi ngapin yang
201,2020/04/02 12:51:36,apakah tema ini perlu kita bahas
202,2020/04/02 11:19:50,teman ini dan bantu amat bijak publik yg lagi hapening nihom matnuryuk
203,2020/04/01 20:05:52,memang harus culik bosnamanya merariqtradisi ini cocok buat entetapi pasti ente belum culik belum culik
204,2020/04/01 19:55:53,kita harus cari akal buat asi
205,2020/04/01 11:26:50,live rapat kerja komisi iii dpr ri dengan menkumham ri
206,2020/04/01 10:30:40,sepeda bisa jadi tempat jemur
207,2020/04/01 09:25:59,mohondoarestu untuk partaigeloraid yang telah recara resmi daftar ke kemenkumhamri dirjen ahu kemarin meski dengan telekonfrensi dan kurang dari menit cc anismatta mahfudzsiddiq
