no,date,tweet
208,2020/04/01 00:06:58,ayo temanteman dan saudara semua ayo bantu tandatangani petisi bebas siti fadilah supari juang sama lawan wabah corona lewat dengan klik link bagai ikut
209,2020/04/01 00:05:49,terima kasih pak sekjen mahfudzsiddiq
210,2020/03/31 23:39:21,mau tau suasana akhir dari temu telekonfrensi tadikatanya ini daftar parpol pertama dari jarak jauh ada lucu
211,2020/03/31 23:25:26,terima kasih kepada kader dan simpaatisan di seluruh indonesia saya ingin sampai kabar kagum para jabat yang terima an dokumen yang kita kumpul lembar demi lebar cara sukarela dari sabang sampai merauke sungguh ini kerja luar biasa geloramohondoa
212,2020/03/31 23:18:37,untuk itu semua partaigeloraid mohon doa restu kepada seluruh bangsa indonesia kami hadir di saat wabah datang tentu kami ingin hadir kokoh baris juang hadap tantang sekali kita mulai lang kita akan terus sama lewat masamasa geloramohondoa
213,2020/03/31 23:12:36,memang dokumen kami telah serah seluruh belum tapi kami tahan diri untuk tidak datang dalam suasana seperti sekarang kata sekjen mahfudzsiddiq bagai penanggungjawab daftar alhamdulillah akhir kami terima lalu telekonfrensi geloramohondoa
214,2020/03/31 23:07:31,kami dapat sambut baik dari pak menteri dan jajar yang tugas bahwa kemenkumhamri sambut baik hadir partaigeloraid bagai kuat baru yang akan beri warna baru pada politik nasional kita ini ikhtiar sama bangun demokrasi kita
215,2020/03/31 23:04:02,meski kami paham pihak kemenkumham sedang laku sesuai proses kerja akibat wabah covid namun kami menyakini bahwa proses verifikasi akan jalan lancar sesuai atur perundangundangan demikian harap tum anismatta kepada menkumham geloramohondoa
216,2020/03/31 23:02:21,hari ini kami cara resmi daftar urus tingkat pusat tkt provinsi tkt kabupatenkota dan tkt camat dan acu kepada permenkumham kami serah lembar dokumen syarat administratif sambut ketua umum anismatta
217,2020/03/31 22:56:44,di tengah pandemi yg luas di tengah kader dan struktur partaigeloraid di seluruh bumi pertiwi terus kerja cari jalan ringan beban sama maka kami pun jajar dpn partai gelombang rakyat indonesia gelora indonesia terus gerak jalan amanah geloramohondoa
218,2020/03/31 22:52:04,sahabat geloramohondoa tadi telah zuhur kami urus partaigeloraid ada telekonfrensi dengan kemenkumhamri khusus dirjen administrasi hukum umum ahu hadir pak menteri dan pak dirjen di layar kami tanda resmi daftar partai baru ini
219,2020/03/31 15:28:57,marhaban ya ramadhan
220,2020/03/31 08:14:54,staysafe jangan lupa minumjamu
221,2020/03/31 08:00:55,untuk beri contoh negara demokrasi yg jadi sorot sukses saya ingin sebut korea selatan taiwan singapore dan beberapa negara lainpendekatan buka adalah model yang anggap bagai anti tesis dekat tutup dalam negara totaliter
222,2020/03/31 07:53:35,wallahua lam
223,2020/03/31 07:53:21,salah paling fatal pimpin demokrasi adalah karena ketika medium partisipasi adalah sadar tapi mereka tidak punya paham akhir mereka kirim pesan yang bingung itu salah yang saya lihat di us india dan italia dan kawan negara demokrasi lain
224,2020/03/31 07:49:31,negara boleh tidak bicara kepada rakyat asal tiap pagi ada makan yang datang ke depan pintu rumah seperti burung boleh sangkar tapi harus beri makan tapi jika makan tidak sedia maka ilah bebas agar ia terbang cari karunia tuhan followership
225,2020/03/31 07:46:52,di korea utara tidak ada berita pimpin tidak rasa perlu rakyat ajak bicara rakyat dimobilisir saja diam di rumah atau jangan keluar daerah angka mati bukan masalah semua sudah biasa bahkan saya lihat wawancara yg kata putus pimpin selalu baik
226,2020/03/31 07:40:38,contoh lain adalah mesir di mana negara kembali rasa takut dengan cara ubah struktur yang sudah bentuk hampir tahun ada kudeta militer lalu buat darurat yang buat negara boleh rampas apa dari rakyat meski darah perintah anggap diri sukses
227,2020/03/31 07:34:06,dalam masyarakat demokrasi partisipasi rakyat sumber dari sadar dalam maayarakat totaliter sumber partisipasi adalah rasa takut kita telah pilih yang pertama jadi jangan harap rasa takut akan bikin urus ini selesai sampai kiamat gak bisa followership
228,2020/03/31 07:31:26,apa yang benar jadi sy lebih cenderung ajak pimpin kita ikut apa yang sudah ada struktur yang sudah bentuk paska amandemen konstritusi dan masyarakat yang bentuk pasca reformasi jangan keluar dari modal dasar kita jangan bikin simpang
229,2020/03/31 07:28:32,dunia sekarang ini melototin beberapa negara dengan bagai modelada negara yang pimpin gak lihat tetapi kasus inveksi dan mati juga tak kelihatanatau sedikit atau anggap sudah hilang ada negara yang pimpin aktif dan tampil tapi kasus tambah banyak
230,2020/03/31 07:24:59,putus apa tidak dengan sendrinya berjalania perlu partisipasi timbang penting para pimpin adalah tentang struktur masyarakat yang sudah bentuk tahun belakang ini perhati india us italy semua negara demokrasi followership
231,2020/03/31 07:24:45,mana aja bro
232,2020/03/30 08:49:24,ada juta video di youtube yang bisa siar lewt tv untuk semua kalang umur mulai dari ceramah ilmu tahu praktek lapang sampai tentang bagaimana bisnis dan mulai buah startup dan timbul jiwa kewirausahaan
233,2020/03/30 08:46:46,negara harus dorong media agar lebih kreatif isi acara yang kandung unsur didik anak kita sedang di rumah karena sekolah mereka tutup maka acara didik anak harus banyak sebab tidak bisa hindar tv akan jadi pilih isi waktu
234,2020/03/30 08:41:31,negara kali ini harus paksa media laku didik yang baik bagi publikpenggunaan frekwensi dan bebas di ruang media harus guna untuk selamat keadaanbukan untuk siar konyol yang tidak sensitif dengan keadaanini khusus buat tv non berita
235,2020/03/30 08:35:19,cemas adalah bukti bahwa kita punya ruang tidak paham atas situasi dan bahkan ada kita sendiritapi tugas pimpin adalah sempit ruang misteri dalam ruang publik kitaitulah arti edukasi publiksalah satu tugas utama politik dari hari ke hari
236,2020/03/29 23:39:30,selamat istirahat sahabat doa untuk yakin karena esok nanti kalimat dan tindak yang tuntun bangsakita dalam krisis besarkita sedang perlu berani laksana keyakinanuntuk negara dan bangsa kita khusus staystrongindonesia
237,2020/03/29 23:33:39,makin banyak kita ajar makin banyak kita pahampaham adalah jalan tuju keyakinandan yakin adalah dasar dari kata dan tindak yang kuatjangan pernah nampak bimbang dan gelisah apalagi jika ada dalam tampuk kepemimpinankarena itu awal bencana besar
238,2020/03/29 22:52:16,mengupdate diri malamtentang situasi kita dan kota
239,2020/03/29 13:50:42,makasih om faldo maju terus di buka sebut partai garbiofficial padahal dia ormas partai saya namnya partaigeloraid om
240,2020/03/29 05:30:30,ya allah sungguh aku lindung kepada engkau dari bingung dan sedih aku lindung kepada engkau dari lemah dan malas aku lindung kepada engkau dari kecut dan kikir dan aku lindung kepada engkau dari lilit hutang dan wenang manusiaalmatsurat
241,2020/03/28 16:01:54,negara telah milik seluruh perangkat untuk tahan perangkat itu tinggal guna negara kita adalah negara pancasila yang milik perangkat budaya untuk lawan cemas lebih bahaya dari corona maka tugas utama pimpin adalah ajak rakyat lawan rasa cemas
242,2020/03/28 15:46:24,publik itu punya daya tahan moril salah satu sumber adalah yakin pemimpinjika pimpin nampak lemah seluruh rakyat akan rasa lemahjika pimpin nampak kuat dan mampu gerak bangsa satu kita teguhini saat pimpin tampil ajak rakyat sama
243,2020/03/28 15:42:02,dalam sistem kita jabat level tinggi harus sering tampil dan bicaraini saat munculhari ini cakap publik perlu arah dan ketenanganjangan nampak bingung dan ragutidak ada jabat yg bisa wakil pimpin intimusuhnya besar jangan pion yg tampil
244,2020/03/28 15:28:39,ayo ikut gera emak ini bantu tenaga medis kita mampu kita yuk savetenagamedis
245,2020/03/28 15:24:08,terima kasih ya emak hebatsemoga yang lain susul bantu tenaga media kitaapapun cara asal ikhlas lillahi ta ala savetenagamedis
246,2020/03/28 12:02:55,ayo follow bunda neno untuk nasehat lama lockdownindonesia
247,2020/03/27 21:10:55,yang gak sempat bisa lihat juga di periscopeco youtube facebook obrol ringan dan santai belajardirumah lockdownindonesia staysafe
248,2020/03/27 20:06:44,lanjutt presidensial lawan wabah
249,2020/03/27 20:01:11,ngobrol politik online presidensial lawan wabah
250,2020/03/27 19:03:27,yuk nonton lockdownindonesia
251,2020/03/27 07:56:01,mr president and who director dont forget to be transparent about the production of vaccines and drugs covid because we are not fighting the virus with power but with openness dont preach while benefiting the rich and oppressing the poor please
252,2020/03/27 05:19:54,subuh dan pagi sahabat ini ada poster bagus inti virus covid tidak bisa gerak dia gerak oleh manusia karena medium tumbuh manusia kalau kita henti gerak virus juga henti dan lalu mati sederhana kan jumatberkah
253,2020/03/25 20:13:52,situasi ini tentu tambah berat beban di pundak dan asa beliau dalam situasi negara yang sedang dalam coba besar hanya doa dan dukung yang beliau dan keluarga harap dari seluruh rakyat indonesia mari kita hantar doa dan munajat alfatihah amin yra
254,2020/03/25 20:11:16,ini saat kita tani presiden jokowi dan keluarga yang sedang dapat musibah dari allah swt dengan doa dari rumah kita masing kita teman beliau dengan doa dlm antar dan ikhlas almarhumah ibunda sudiatimi notomihardjo yg telah panggil allah swt
255,2020/03/25 18:08:52,innaillahi wa inna ilaihi roji unturut duka atas wafat ibunda bapak presiden jokowi ibu sudjiatmi notomihardjo moga allah swt ampun segala dosa dan tempat di sisi yang maha mulia amin yra
256,2020/03/25 08:50:04,pagi sahabat bahwa rasa takut dan cemas itu efek pada bobol sistem imunitas tubuh kita maka mari kita lawan itu semua dengan yakin bahwa kita berani dan optimis itu saya yakin kuat kebal tubuh lawan virus dan sakit apa
257,2020/03/24 23:19:53,dar terus aspirasi kolegaterima kasih atas perhati tugas bnpbindonesia kemenkesri kemenkopmk aniesbaswedan pemdadkijakarta savetenagamedis
258,2020/03/24 22:55:57,jumlah rujuk lewat wa suspec covid masuk spgdt maret kasus diskusi pagi ini tim medik gercep ada pasien dgn hasil pasien pdp yang tidak bisa masuk ke rsf karena fasilitas belum rampung dan orang yang masih stagnan di rs nya atau pulang
259,2020/03/24 22:54:30,ini data per hari ini jumlah total pasien yg duga covid yg layan di rs fatmawati jaksel semenjak tunjuk jadi rs rujuk corona virus per maret ada orang jumlah odp maret orang jumlah pdp di lantai igd per maret orang savetenagamedis
260,2020/03/24 22:37:56,depan kita akan hadap dengan risiko tular covid kepada tenaga medis utama di frontline ini bahaya jika perang yang lakon paramedik kita tidak lengkap dengan senjata yang pada saya sampai suara hati mereka cc bnpbindonesia
261,2020/03/24 22:32:37,karena batas supply dari perintah sampai kita sendiri di frontline tuntut aktif untuk swadana swadaya serta kreatifitas sendiri buat apd masker lindung dll yang notabene mungkin besar jauh bawah kriteria standar lindung sesuai sop nya
262,2020/03/24 22:30:37,hari ke depan mana jumlah pasien yang baru mau capai puncak wabah mungkin dalam minggu ini turut kira epidemiologisedangkan amunisi baik itu upa masker apd sanitizer serta obat bagai tenaga medis dan paramedis sangat terbatassavetenagamedis
263,2020/03/24 22:26:47,mohon perhati bnpbindonesia kemenkesri poster ini sampai oleh kolega saya di rs fatmawati jakarta mereka bikin iklan mohon donasi apd alat lindung diri mereka khawatir langka apd akan jadi bencana bagi tugas medis kita ke depan
264,2020/03/24 10:33:42,aku jadi ngerti boso jowo akublas
265,2020/03/24 10:19:52,kalau kalian biasa benci kepada bangsa sendiri maka dalam ada ada serang yang asal dari luar pun seperti sekarang kalian tidak tau cara rakit satu saban hari masih cari musuh dari bangsa sendiri padahal jelas musuh datang dari luar kita belum sadar lur
266,2020/03/24 10:11:17,corona datang karena pola fitnah kayak gin milik akun kasus akun dibajakdirampas lalu akun itu kelola oleh admin buzzer lalu pakai ngetwit sensasionaladmin buzzer lalau kutip media buzz perhati milik asli akun pasti orang kasus
267,2020/03/23 20:45:33,aku dah bukan anggota dpr
268,2020/03/23 14:35:48,masih aja ada yg giniaku gak nyalon dinda orang lagi nagih hutang juga
269,2020/03/23 14:28:04,jubir presiden harus punya selera humor yg tinggi
270,2020/03/23 08:57:19,masa depan harus gambar jelas apa ujung dari semua iniajak semua orang dalam lorong besar tuju masa depandengan cara masingmasing kita akan sampai ke sana di tengah jalan kita akan saling gotong royong dan kuat kita akan sampai tuju sama insya allah
271,2020/03/23 08:20:47,negara jika ia ingin andal laku antisipasi bencana yang kebih besar mobilisasi sumberdaya bagi yang telah tumbang dan beri subsidi kepada rakyat dampak langsung dan beri jamin kepada tugas yang ada lini di depan negara kita harus tegak jiwa otonomi
272,2020/03/23 08:17:49,pagi kalau aku lihat tak ada yang terlalu bisa andal di luar sananegara atau otoritasakhirnya kembali pada diri jaga jarak pakai masker cuci tanganatau kalau bisa tidak keluar tetap di rumahsimpatiku kepada yang kerja untuk haridan untuk jaga kita
273,2020/03/23 08:03:15,kira kalau sambel ini masuk tadi sama singkong korona ke mana ya aku keringetan
274,2020/03/23 07:54:08,entah apa nilai anda tapi sarap pagi ini pakai singkong goreng lawancorona
275,2020/03/22 23:30:17,istigfar
276,2020/03/22 23:28:01,akhir dari tempat tidur saya ingat bahwa kita benar tiap hari mati sebentar lalu kita lupa tak bawa mimpi tak ada nyata tak ada materi dengan nama allah aku hidup dan aku mati sekian
277,2020/03/22 23:23:27,hai xi jinping apa kabar wuhan apa kabar masa depan hai trump ngomong terus sampean biasa hanya twitteran hai raja salman kapan boleh umroh jangan lupa haji wajib jangan henti hai jokowi sing sabar ya pak hai fahri kok belum tidur sampeyan
278,2020/03/22 23:15:55,di dunia di timur barat utara selatan corona bongkar topeng ilmu sok pintar nampak bodoh ulama jadi ingin rasional kuasa nampak lemah rumah ibadah ikut negara kantor negara ikut media sosial media sosial ikutikutan politis sembunyi di tempat terang
279,2020/03/22 23:07:54,hai ilmu semua yang kita tidak tahu itu tuhan maha tau maka dalam situasi darurat milik iman agar kita juga sandar pada rendah hati terlalu banyak yg tak kita tahu hai ulama takut pada allah jangan takut pada ilmu ajak ummat tawakkal dan doa
280,2020/03/22 23:00:15,ingin melek terus tapi kita harus istirahat kita lanjut besok sahabat tawakkal pada allah janganlupaberdoa
281,2020/03/22 21:25:07,ayok ngaku siapa yang berani mimpin sekarangtunjuk tangan semuanampaksemu
282,2020/03/22 21:22:18,gin amat ya
283,2020/03/22 21:16:45,aku mau keluar cukur ada gak yg cukur oleh robot ya
284,2020/03/22 18:10:05,om jangan hadap bebas dengan cemas olah ia akan mematikankebebasan ada di tangan semua orang masuk para jabat yang gaji untuk kata yang benar lebih keras dari kemapuan para pembuay berita hoax itu akal sehat rakyat tunggu berita istana lebih kuat
285,2020/03/22 17:50:13,selamat ingat isramirajh bagi kaum muslimin moga musibah ini ada hikmah bagi baik ummat dan bangsa kita ke depan moga bangsa indonesia kita bangkit dan maju menang lomba tegak baik pada dunia kita yang makin perlu baik
286,2020/03/22 17:47:33,maka rasa pada tanggal rajab ini pasuk bulan jelang ramadan maka kita seperti perlu banyak introspeksi dengan jadi luar biasa klb yang kita hadap memang semu harus kembali pada baik diri baru lingkung bisa baik
287,2020/03/22 17:44:32,maka jika hikmah ingin kita petik pada momen isramirajh ini adalah dialog dan doa yang ajar kepada nabi saw dalam jalan beliau ajar banyak zikir selain istigfar adalah la haula wala quwwata illa billah tidak ada daya upaya kita kecuali allah swt
288,2020/03/22 17:37:01,sekarang kita merayalan isramiraj dalam suasana pandemi coronaviruspandemic yang gempar ummat manusia ada jelas ilmiah atas semua jadi tapi bagi yang yakin pasti ada yang tak bisa jelas sehingga datang tiba tak baca dari mana mau ke mana
289,2020/03/22 17:33:09,di samping iman selalu ada tantang untuk bukti bahwa sesuatu yang belum anggap misteri dan mustahil akhir bisa bukti cara ilmiah lalu kita gembira bahwa iman kita bukti cara saintifik tapi itu hidup di dunia penuh dialektika belum iman
290,2020/03/22 17:30:22,ingat isramiraj selalu istimewa karena jalan ini beri istimewa kepada nabi muhammad saw hanya beliau yang sampai kepada pohon abadi sidrat al muntaha iti dan di sana perintah sholat langsung terima untuk ummat ya ini semua peristiwa iman
291,2020/03/22 17:23:35,hari ini ada peristiwa isramiraj yg belum sepenuh bisa cerna akal manusiabagi muslim jalan dari masjid haram di makkah tuju alaqsa di palestina lalu lanjut ke langit yg sebut sidrat al muntaha untuk terima perintah sholat waktu hanya malam
292,2020/03/22 16:26:39,ya
293,2020/03/22 16:25:58,data baru di kita sudah tinggal
294,2020/03/22 16:02:35,teman tengok data akhir tinggal di indonesiakalau gak hati bisa lompat kayak italiyg sudah an meninggalkalau benar data dki belah kanan bahwa carriernya mayoritas usia mudamaka yg muda harus nahan diriwaspada jadi antara virus
295,2020/03/22 15:07:31,siap salah
296,2020/03/22 14:54:15,ini waktu alkohol tidak kita minum lagitapi kita jadi desinfektansanitizerdan bahan antiseptik medik lainnyaayo
297,2020/03/22 14:21:15,mari kita yang punya mewah tinggal di rumah ini doa yang tidak bisa tinggal di rumah karena wajib mereka doauntukduniabebascorona
298,2020/03/22 11:23:17,harus ada masyarakat ahli virus di indonesiajangan ada jugaada yg tau
299,2020/03/21 23:29:22,tidur gih
300,2020/03/21 18:00:12,daya tahan tubuh kita adalah kunci dan salah satu yang jasa adalah asi yang kita minum sejak lahir sampai umur tahunsudahkah kita terima kasih kepada ibu kandung yang susu kita terimakasihibu jagastamina
301,2020/03/21 12:03:24,sarap tadi pagi pakai jersey baya biar nampak rada bonek dalam suasana lockdown berapa harga di pasar naik gak ya jamu rp vit c rp kopi susu onta rp jambu klutuk rp air putih gratis jangan lupa tetap jaga sehat
302,2020/03/20 20:25:07,ngobrol lagi malam ini
303,2020/03/20 15:45:43,perintah suruh masuk gua ashabul kahfi
304,2020/03/20 11:35:43,ikan jangan goreng ya
305,2020/03/19 23:05:37,selamat tidur ya meski besok kita beri kembali waktu jamtetap doa agar tuhan terima amal kita hari ini dan kita maaf yg salah kepada kitatidur harus lapang tanpa bebanamin
306,2020/03/19 23:01:08,saya harus putar badan masbiasanya gitu
307,2020/03/19 22:41:22,live presiden realdonaldtrump yg malas bicara ke media saja jadi bikin briefing tiap haridan bekerjasama dengan kongres siap dana tambah untuk atas coronavirusupdate bagaimana dengan negara kita
308,2020/03/19 20:58:27,bagi yg punya instagram ini ada himbauan bunda neno untuk jaga diri sendiri keluarga dan orang lain cc fadlizon sandiuno aniesbaswedan yuk stay di rumah keluar rumah hanya jika perlu yaaa himbauan coronavirus coronadiindonesia
309,2020/03/19 13:21:52,salam sayang jarak jauh ya brobagus aku gak jumpatapi kita doa berkah umur bagi
310,2020/03/19 12:59:37,telah zuhur saya ucap selamat makan siang tapi ini menu sarap tadi pagi buah semangka vitamin c dosis tinggi kopi susu onta jamu jokowi jagajarakcoy jagastamina
311,2020/03/19 10:21:18,waktu itu kamu belum lahir nak
312,2020/03/19 10:08:23,dampak selfisolation dan lockdown jagajarakcoy raja minyak urut cenderung kerja di rumah tapi masih goda cari kopi keluar rumah sore kalau korona dah pergi sehatselalugaes jagastamina
313,2020/03/19 00:04:33,moga surat buka ini buka mata akan jahat konspirasi tegak hukum di masa lalu yang incar musuh negara lain yang ada di dalam negeri sungguh kejam bebaskansitifadilah pahlawan dalam masa kita saat ini terima kasih cc prabowo wapresri kemenkesri
314,2020/03/19 00:00:58,maka pasuk usia beliau yang sudah tua dan sakitsakitan saat perintah perlu pandang lain tentang virus dan vaksin bebas ibu siti fadilah dia teman bicara yang benar dia yang bisa lihat peristiwa ini dalam penting nasional
315,2020/03/18 23:58:16,lima tahun hidup mnya habis cara kejam dalam adil media yg sadis dan sejak vonis tahun sampai sekarang ia masih dekam dalam penjara kenapa tegak hukum tega dengan ibu yang sederhana ini ini bukan soal hukum bapak presiden ini soal politik
316,2020/03/18 23:55:26,lihat kronologi akhir jadi menteri yang sederhana jadi krisis sehat di aceh yang buat beliau ambil bijak khusus lama jadi menteri terus kritis tentang konspirasi vaksin dan senjata biologi th sangka dan baru vonis
317,2020/03/18 23:33:54,tiga tahun telah pensiun ibu siti fadilah jadi sangka kasus duga korupsi pada bulan april atas proyek ada alat sehat untuk jadi luar biasa tahun nila milyar rupiah dengan kira rugi negara besar milyar rupiah
318,2020/03/18 23:29:13,buku ini tuai protes dari petinggipetinggi who dan as buku edisi bahasa inggris tarik dari edar untuk laku revisisedangkan buku edisi bahasa indonesia masih edar dan pasuk cetak ke lihat kronologi
319,2020/03/18 23:27:33,buku anggap bongkar konspirasi who dan as siti fadilah buka kedok world health organization who yang telah lebih dari tahun wajib virus sharing yang nyata banyak rugi negara miskin dan kembang asal virus sebut
320,2020/03/18 23:25:23,pada tanggal januari siti fadilah rilis buku saat dunia ubah tangan tuhan di balik virus flu burung yang isi kena konspirasi amerika serikat dan who dalam kembang senjata biologis dengan guna virus flu burung bebaskansitifadilah
321,2020/03/18 23:23:45,telah itu ia usaha kembali hak indonesia pada maret indonesia umum bahwa mereka telah capai sepakat dengan who untuk mulai kirim virus dengan cara baru untuk beri akses vaksin hadap negara berkembangbebaskansitifadilah
322,2020/03/18 23:22:15,tulis di laman wikipedia datadata ikut siti fadilah akhir kirim virus flu burung ke laboratorium who pada november karena takut akan kembang vaksin yang lalu jual ke negaranegara kembang ini timbul tegang bebaskansitifadilah
323,2020/03/18 23:17:43,sejak lantik beliau yang sederhana ini sangat peduli dengan sehat rakyat ia juga peduli dengan isu sehat bagai tahan nasional pandang ini buat sangat berhatihati dengan giat pihak luar masuk who dalam ambil sumberdaya nasional kita
324,2020/03/18 23:14:33,beliau pilih bagai kader muhammadiyah umur sekarang hampir tahun ia masih dekam di penjara saya saksi sederhana oleh pak sbyudhoyono dan pak pakjk beliau percaya jadi menteri sehat dan lantik tanggal oktober
325,2020/03/18 23:11:08,yang hormat pak jokowi dan pak prabowo ini waktu bapak bebas ibu siti fadhilah supari orang jenius indonesia yang jadi korban konspirasi jahat ia jadi dosen jadi ahli dan pimpin teliti di bagai lembaga akademik puluh tahun
326,2020/03/18 19:32:44,memang jalan masih padatbelum ada lockdownnkri tol jagorawi ke arah cibubur
327,2020/03/18 09:33:17,sarap pagi jamu rempah rp jambu klutuk rp kopi racik rp total rp ingat iklan milu
328,2020/03/17 23:29:21,jaga sehat jaga stamina ijin tidur dulu ya
329,2020/03/17 23:27:59,saya hanya kagum cara mereka hadap masalahdialog dengan wartawan di lingkugan gedung putih yang kenal kritis dan tajampresiden damping para ahli yg telah angkat jadi anggota tim gerak cepatbangsa itu lihat satu kembaliitu aja sih
330,2020/03/17 22:54:41,jangan singgung itu hanya kutip media cnbc yg siar langsung pagi ini lawancovid
331,2020/03/17 22:52:54,lalu wakil presiden mikepence muncul di belah presiden yakin pasar dan rakyat amerika bahwa dwngan kepenimpinan peesiden trump mereka bisa atas semua masalah inibahkan yakin semua akan atas secepatnyalihat belah pasar modal gerak positif
332,2020/03/17 22:45:25,presiden amerika lagi briefing dari whitehouse dan pasar modal langsung reaksi positif tanda pasar optimispresiden realdonaldtrump pimpin langsung konfrensi pershampir tiap haridan yakin kongres supaya mau kesah paket stimulus
333,2020/03/17 22:41:57,kata idris elba dia gk rasa gak enak badan tiba kena covid dengar lanjut
334,2020/03/17 22:03:11,saya sudah pensiun karena tidak calon diri lagijangan cari aku dalam perintah tapi cari aku di mpr mall plaza dan restauran
335,2020/03/17 10:08:06,maka jangan pikir negatif dalam krisis singkir ini waktu lihat peluangini waktu temu hal yang tak ada dalam masa normaldingin jaga stamina telah itu kita akan pukau dengan hal baru yang akan hadir di hadapaninilah peluang dan sempat
336,2020/03/17 09:38:34,bayang tua ini kita kita harus ajar cuci tangan lagidan kita mauyang muslim ajar wudhu lagiatau ajar dasar tentang jaga bersih dasarmemang kita perlu ajar lagitak perlu malubangsa kita ajar minum jamu lagicintailah produk indonesia
337,2020/03/17 09:33:45,sehat selalu suatu yg patut syukur karena hari ini kita mulai pikir cara bekerjasituasi ini akan temu jalanjalan baruarah barusemoga bangsa ini temu cara untuk jadi besarindonesia raya great indonesiakita ini perlu inspirator
338,2020/03/16 23:14:57,polusi udara berkurangharga saham jatuhdan terbang berkuranghanya ada kata bobok sekarang juga lawancoronabersama jagajarakdulu
339,2020/03/16 22:57:40,nonton berita resmi who
340,2020/03/16 22:56:11,anda lebih sopan
341,2020/03/16 22:55:22,heran aku olah raga kok banyak yang degdegan
342,2020/03/16 22:53:41,takut kuda mati kelindes
343,2020/03/16 22:53:11,aku belum pernah ngalamin mas
344,2020/03/16 18:09:36,ada yang tidak percaya bahwa tadi pagi saya olah ragaini salah satu sesi sesi lurus tulangkalau ada orang yg agak sehat kayak saya bukan gendut yaawas lalu biasa ini biar tulang anda utama bagi belakang gak jepit sarafok
345,2020/03/16 07:34:03,sultan maroko sarap pagi pakai gelas jamu dan buahwajah sedih mikirin apa ya sehat selalu semuanyajagastamina
346,2020/03/15 22:15:14,tidur cepat aja biar jaga stamina gih
